{
  "evaluation_id": "024a8417fdc24b2a1af9",
  "first_run_id": "b90e16be05d7f54c69e4",
  "fixtures": [
    {
      "deterministic": true,
      "division_paths": [
        "divisions/wa/local/seattle_5363000_323546d6-d859-53ea-9403-bd5680b2ab05.yaml"
      ],
      "exception_class": null,
      "expected_archetype": "AR-001",
      "expected_classification": "government",
      "failures": [],
      "generation_status": "generated",
      "human_minutes": 0.0,
      "inferred_classification": "government",
      "jurisdiction_name": "Seattle",
      "jurisdiction_paths": [
        "jurisdictions/wa/local/seattle_200747ac-8010-510a-b0be-7fce0ae00bff.yaml"
      ],
      "output_hashes": {
        "divisions/wa/local/seattle_5363000_323546d6-d859-53ea-9403-bd5680b2ab05.yaml": "fb487965148729f4b041fe1fa2eb6e28cf20f9ad7d247324c28de3dde866182d",
        "jurisdictions/wa/local/seattle_200747ac-8010-510a-b0be-7fce0ae00bff.yaml": "349e339bcbc2fd099b9f72e3a842e3b9f094f6780dc99390290538ecdfa770f0"
      },
      "resolved_ocdids": [
        "ocd-division/country:us/state:wa/place:seattle"
      ],
      "review_reason": null,
      "status": "passed",
      "target_id": "BP25-001"
    },
    {
      "deterministic": true,
      "division_paths": [
        "divisions/wa/local/tacoma_5370000_f7a3a1b6-57c5-5b88-a1e3-1232c5272a6f.yaml"
      ],
      "exception_class": null,
      "expected_archetype": "AR-001",
      "expected_classification": "government",
      "failures": [],
      "generation_status": "generated",
      "human_minutes": 0.0,
      "inferred_classification": "government",
      "jurisdiction_name": "Tacoma",
      "jurisdiction_paths": [
        "jurisdictions/wa/local/tacoma_da99d54b-e54b-524e-83b4-b7a593240c21.yaml"
      ],
      "output_hashes": {
        "divisions/wa/local/tacoma_5370000_f7a3a1b6-57c5-5b88-a1e3-1232c5272a6f.yaml": "f32c380ff32f50ebc16607a90dbfebdf9e78db7a0724504c9875a835c88d3f26",
        "jurisdictions/wa/local/tacoma_da99d54b-e54b-524e-83b4-b7a593240c21.yaml": "e81522d3d63f8b26b9ed640d6dc230ea8e30243e3ac2f4c5b4691e8c8fbb5e9c"
      },
      "resolved_ocdids": [
        "ocd-division/country:us/state:wa/place:tacoma"
      ],
      "review_reason": null,
      "status": "passed",
      "target_id": "BP25-002"
    },
    {
      "deterministic": true,
      "division_paths": [
        "divisions/wa/local/pierce_county__3c00afd9-8478-52f8-ba1c-8cd27a495f5d.yaml"
      ],
      "exception_class": null,
      "expected_archetype": "AR-002",
      "expected_classification": "government",
      "failures": [],
      "generation_status": "generated",
      "human_minutes": 0.0,
      "inferred_classification": "government",
      "jurisdiction_name": "Pierce County",
      "jurisdiction_paths": [
        "jurisdictions/wa/local/pierce_bf353bec-1938-55cd-be36-0ef8e1bab286.yaml"
      ],
      "output_hashes": {
        "divisions/wa/local/pierce_county__3c00afd9-8478-52f8-ba1c-8cd27a495f5d.yaml": "5b51493db894e4740bf8d1911be19919db28126fae7d71dbaf5ea4a371d8f007",
        "jurisdictions/wa/local/pierce_bf353bec-1938-55cd-be36-0ef8e1bab286.yaml": "90122d1147ba2049d82e82dbbf9d98522b7a4c55b4111564acfee8354b33dd2f"
      },
      "resolved_ocdids": [
        "ocd-division/country:us/state:wa/county:pierce"
      ],
      "review_reason": null,
      "status": "passed",
      "target_id": "BP25-009"
    },
    {
      "deterministic": true,
      "division_paths": [
        "divisions/co/local/colorado_springs_school_district_no._11__535d01fb-7ce9-5d37-a2cb-2b4d0ad27622.yaml"
      ],
      "exception_class": null,
      "expected_archetype": "AR-003",
      "expected_classification": "school_system",
      "failures": [],
      "generation_status": "generated",
      "human_minutes": 0.0,
      "inferred_classification": "school_system",
      "jurisdiction_name": "Colorado Springs School District 11",
      "jurisdiction_paths": [
        "jurisdictions/co/local/colorado_springs_school_district_no._11_2fc8bf53-13ca-558a-90d7-46e44ce037fe.yaml"
      ],
      "output_hashes": {
        "divisions/co/local/colorado_springs_school_district_no._11__535d01fb-7ce9-5d37-a2cb-2b4d0ad27622.yaml": "b6af41db3e9fefe4c931b09d58df008f948151a3ebb59e65555799820a720445",
        "jurisdictions/co/local/colorado_springs_school_district_no._11_2fc8bf53-13ca-558a-90d7-46e44ce037fe.yaml": "42ad366de47e59ee23a811f3cbed6ef3e2764b04700228bd0fdc051c9cbed1b3"
      },
      "resolved_ocdids": [
        "ocd-division/country:us/state:co/county:el_paso/school_district:colorado_springs_school_district_no._11"
      ],
      "review_reason": null,
      "status": "passed",
      "target_id": "BP25-014"
    },
    {
      "deterministic": true,
      "division_paths": [
        "divisions/co/local/regional_transportation_district__6cfe3b86-0fd3-5b34-8848-b8e321ed1121.yaml"
      ],
      "exception_class": null,
      "expected_archetype": "AR-004",
      "expected_classification": "transit_authority",
      "failures": [],
      "generation_status": "generated",
      "human_minutes": 0.0,
      "inferred_classification": "transit_authority",
      "jurisdiction_name": "Regional Transportation District",
      "jurisdiction_paths": [
        "jurisdictions/co/local/regional_transportation_district_4665e0ef-66c7-55fe-b6f0-385e2609d711.yaml"
      ],
      "output_hashes": {
        "divisions/co/local/regional_transportation_district__6cfe3b86-0fd3-5b34-8848-b8e321ed1121.yaml": "d478dceb4a2c7c011bbbc40c66a22a7a4d9e9b496f15ac802395fd5f677fd8df",
        "jurisdictions/co/local/regional_transportation_district_4665e0ef-66c7-55fe-b6f0-385e2609d711.yaml": "91743902389b57b91d6ed3728597e12c340d6c2d4293a23e0f0a68c302447eb5"
      },
      "resolved_ocdids": [
        "ocd-division/country:us/state:co/special_district:regional_transportation_district"
      ],
      "review_reason": null,
      "status": "passed",
      "target_id": "BP25-018"
    },
    {
      "deterministic": true,
      "division_paths": [
        "divisions/co/local/denver_0820000_eac2c839-9df8-52a4-b0c0-b991e823cd53.yaml",
        "divisions/co/local/denver_county__dfec8fbb-dfe0-5c67-8201-3fa6efbfa3a3.yaml"
      ],
      "exception_class": "upstream_alias_noncanonical",
      "expected_archetype": "AR-005",
      "expected_classification": "government",
      "failures": [
        "first_run: generated fixture still has exception_class='upstream_alias_noncanonical'",
        "first_run: generated fixture still has a review_reason",
        "second_run: generated fixture still has exception_class='upstream_alias_noncanonical'",
        "second_run: generated fixture still has a review_reason"
      ],
      "generation_status": "generated",
      "human_minutes": 0.0,
      "inferred_classification": "government",
      "jurisdiction_name": "City and County of Denver",
      "jurisdiction_paths": [
        "jurisdictions/co/local/denver_74c899d1-8abd-5a2c-8839-075721d25911.yaml",
        "jurisdictions/co/local/denver_c9595597-9ec3-5c12-a4a6-d5d9665ad7c5.yaml"
      ],
      "output_hashes": {
        "divisions/co/local/denver_0820000_eac2c839-9df8-52a4-b0c0-b991e823cd53.yaml": "89fa44f1a7c11d17d29183dc72a4d55950b96c3defaaee02cadcd1c49a776145",
        "divisions/co/local/denver_county__dfec8fbb-dfe0-5c67-8201-3fa6efbfa3a3.yaml": "4f8acb19447aa1773f07e03dd35c3bacc9be0584da674ef39abe9bc11ca21cf7",
        "jurisdictions/co/local/denver_74c899d1-8abd-5a2c-8839-075721d25911.yaml": "c25bce330b3e357ce0d4dadda4e23f367706dec973cb0077a8b2794af10e4323",
        "jurisdictions/co/local/denver_c9595597-9ec3-5c12-a4a6-d5d9665ad7c5.yaml": "ccf88b1594bdcfa6fda54284a787c5b26c9eda9721af444f791b62a303b0880f"
      },
      "resolved_ocdids": [
        "ocd-division/country:us/state:co/county:denver",
        "ocd-division/country:us/state:co/place:denver"
      ],
      "review_reason": "Alias group generated multiple Jurisdiction artifacts; one canonical Jurisdiction is required.",
      "status": "failed",
      "target_id": "BP25-022"
    }
  ],
  "manifest_name": "batch_pilot_25",
  "manifest_sha256": "733e7bc7ddf40e4905105dcf60389fbb95a3dd17eb348414b7d643d8deeb81fb",
  "run_asof": "2026-08-02T15:00:00Z",
  "schema_version": 1,
  "second_run_id": "b90e16be05d7f54c69e4",
  "summary": {
    "deterministic_count": 6,
    "failed_count": 1,
    "fixture_count": 6,
    "gate_passed": false,
    "human_review_gate": "passed",
    "median_human_minutes": 0.0,
    "passed_count": 5,
    "report_content_match": true
  },
  "upstream": {
    "repository": "openstates/jurisdictions",
    "revision": "6fbe7d6aed32c3b781490c8e4c5a737bdd6e4705"
  }
}
